{
  "schema_version": "benchx/comparison-document/0.1.0",
  "mode": "history",
  "method": {
    "name": "benchx/dispersion-scaled",
    "version": "v1",
    "effect_measure": "relative",
    "configuration": {
      "k": 3.0,
      "window": 20,
      "min_points": 4
    }
  },
  "estimator": {
    "name": "min",
    "method_version": "benchx/min/v1",
    "input_level": "observations"
  },
  "identity_schema": "arrow/identity/v2",
  "local_only": false,
  "units": [
    {
      "workload": {
        "name": "parquet-read",
        "parameters": {
          "compression": "snappy"
        }
      },
      "quantity": "wall-time",
      "series": "5b7d9f1a3c5e7b9d1f3a5c7e9b1d3f5a7c9e1b3d5f7a9c1e3b5d7f9a1c3e5b7d",
      "target": {
        "producer": "example.org/arrow-adapter",
        "ingest_key": "ci-1240:parquet-read/snappy:wall-time"
      },
      "reference": [
        {
          "producer": "example.org/arrow-adapter",
          "ingest_key": "ci-1236:parquet-read/snappy:wall-time"
        },
        {
          "producer": "example.org/arrow-adapter",
          "ingest_key": "ci-1237:parquet-read/snappy:wall-time"
        },
        {
          "producer": "example.org/arrow-adapter",
          "ingest_key": "ci-1238:parquet-read/snappy:wall-time"
        },
        {
          "producer": "example.org/arrow-adapter",
          "ingest_key": "ci-1239:parquet-read/snappy:wall-time"
        }
      ],
      "ordering": "ancestry",
      "boundaries": [
        {
          "kind": "distribution-reset",
          "at": {
            "producer": "example.org/arrow-adapter",
            "ingest_key": "ci-1236:parquet-read/snappy:wall-time"
          },
          "detail": "runner kernel upgraded"
        }
      ],
      "reference_estimate": 0.0102,
      "effect": -0.008,
      "noise": 0.004,
      "noise_source": "reference-points",
      "threshold": 0.012,
      "verdict": "no-change-detected",
      "observed_context_differences": [
        "kernel"
      ]
    }
  ],
  "missing": [],
  "exclusions": [
    {
      "result": {
        "producer": "example.org/arrow-adapter",
        "ingest_key": "ci-1235:parquet-read/snappy:wall-time"
      },
      "reason": "status error"
    }
  ],
  "inputs": [
    {
      "producer": "example.org/arrow-adapter",
      "ingest_key": "ci-1235:parquet-read/snappy:wall-time"
    },
    {
      "producer": "example.org/arrow-adapter",
      "ingest_key": "ci-1236:parquet-read/snappy:wall-time"
    },
    {
      "producer": "example.org/arrow-adapter",
      "ingest_key": "ci-1237:parquet-read/snappy:wall-time"
    },
    {
      "producer": "example.org/arrow-adapter",
      "ingest_key": "ci-1238:parquet-read/snappy:wall-time"
    },
    {
      "producer": "example.org/arrow-adapter",
      "ingest_key": "ci-1239:parquet-read/snappy:wall-time"
    },
    {
      "producer": "example.org/arrow-adapter",
      "ingest_key": "ci-1240:parquet-read/snappy:wall-time"
    }
  ]
}
